{
  "schema_version": "1",
  "id": "inv_7fd1e45d",
  "title": "MCP never runs unapproved tests",
  "assertion": "The MCP verify tool accepts only the `changed` and `all` scopes and refuses to run proposed tests.",
  "scope": {
    "paths": [
      "seamspec/mcp_server.py"
    ],
    "tags": []
  },
  "status": "LOCKED",
  "origin": {
    "type": "prompt",
    "text": "Owner (2026-10-07, dogfooding): \"installed the plugin, go ahead and propose the rules\". Candidate from SPEC §12.4.3.",
    "ref": null
  },
  "verification": {
    "runner": "pytest",
    "harness_path": ".seamspec/tests/test_inv_7fd1e45d.py",
    "harness_sha256": "8d1088dd6586a5e8b64bc4360689eda239cb5740d9bb661c1247c599626f54e6",
    "assertion_sha256": "14df32281aebe9e2116221ec84322aab18834743a74af75008fbfb317687d3c3"
  },
  "adr_id": null,
  "created_at": "2026-10-07T00:15:54.078323Z",
  "approved_at": "2026-10-07T00:18:13.812949Z",
  "approved_by": "vamship",
  "superseded_by": null,
  "status_reason": null
}
