{
  "schema_version": "1",
  "id": "inv_22e94e77",
  "title": "Wrappers never run a seamspec from the current folder",
  "assertion": "The plugin wrappers and the git pre-commit hook never execute a `seamspec` file in the current folder, even when PATH is empty.",
  "scope": {
    "paths": [
      "seamspec-plugin/scripts/**",
      "seamspec/installers/git_hooks.py"
    ],
    "tags": []
  },
  "status": "LOCKED",
  "origin": {
    "type": "prompt",
    "text": "Owner (2026-10-07, dogfooding): \"installed the plugin, go ahead and propose the rules\". Candidate from ADR-20261005-9b8f.",
    "ref": null
  },
  "verification": {
    "runner": "pytest",
    "harness_path": ".seamspec/tests/test_inv_22e94e77.py",
    "harness_sha256": "b85da8e4e16ac68cc140e3256b92b18944689d059a5d8cd78f4e17141475aa34",
    "assertion_sha256": "9aa8a9b14d2dfb51badcb24f4508034741d052d3dada85f40074a3586af0996e"
  },
  "adr_id": null,
  "created_at": "2026-10-07T00:15:54.242739Z",
  "approved_at": "2026-10-07T00:18:18.787424Z",
  "approved_by": "vamship",
  "superseded_by": null,
  "status_reason": null
}
